{
  "player_uid": "pl_salah",
  "season_id": "2025-26",
  "competition_uid": "comp_pl",
  "yellow_cards": 2,
  "red_cards": 0,
  "suspension_matches_remaining": 0,
  "observed_at": "2026-07-21T12:00:00Z",
  "available_at": "2026-07-21T12:00:00Z",
  "provenance": {
    "source_ids": [
      "fpl-official-endpoints"
    ],
    "transformation_version": "0.1.0",
    "ruleset_id": "2026-27-v0.1"
  }
}
